{
    "name": "dark",
    "displayName": "Dark",
    "description": "经典暗色主题,适合长时间编码",
    "author": "AI-TERM Team",
    "version": "1.0.0",
    "terminal": {
        "background": "#1e1e1e",
        "foreground": "#ffffff",
        "cursor": "#ffffff",
        "selectionBackground": "rgba(255, 255, 255, 0.3)",
        "black": "#000000",
        "red": "#cd3131",
        "green": "#0dbc79",
        "yellow": "#e5e510",
        "blue": "#2472c8",
        "magenta": "#bc3fbc",
        "cyan": "#11a8cd",
        "white": "#e5e5e5",
        "brightBlack": "#666666",
        "brightRed": "#f14c4c",
        "brightGreen": "#23d18b",
        "brightYellow": "#f5f543",
        "brightBlue": "#3b8eea",
        "brightMagenta": "#d670d6",
        "brightCyan": "#29b8db",
        "brightWhite": "#ffffff"
    },
    "hljs": "atom-one-dark"
}