{
    "name": "nord",
    "displayName": "Nord",
    "description": "北欧风格,清新淡雅",
    "author": "Arctic Ice Studio",
    "version": "1.0.0",
    "terminal": {
        "background": "#2e3440",
        "foreground": "#d8dee9",
        "cursor": "#d8dee9",
        "selectionBackground": "#4c566a",
        "black": "#3b4252",
        "red": "#bf616a",
        "green": "#a3be8c",
        "yellow": "#ebcb8b",
        "blue": "#81a1c1",
        "magenta": "#b48ead",
        "cyan": "#88c0d0",
        "white": "#e5e9f0",
        "brightBlack": "#4c566a",
        "brightRed": "#bf616a",
        "brightGreen": "#a3be8c",
        "brightYellow": "#ebcb8b",
        "brightBlue": "#81a1c1",
        "brightMagenta": "#b48ead",
        "brightCyan": "#8fbcbb",
        "brightWhite": "#eceff4"
    },
    "hljs": "nord"
}