{
    "name": "dracula",
    "displayName": "Dracula",
    "description": "吸血鬼主题,神秘而优雅",
    "author": "Dracula Theme",
    "version": "1.0.0",
    "terminal": {
        "background": "#282a36",
        "foreground": "#f8f8f2",
        "cursor": "#f8f8f2",
        "selectionBackground": "#44475a",
        "black": "#21222c",
        "red": "#ff5555",
        "green": "#50fa7b",
        "yellow": "#f1fa8c",
        "blue": "#bd93f9",
        "magenta": "#ff79c6",
        "cyan": "#8be9fd",
        "white": "#f8f8f2",
        "brightBlack": "#6272a4",
        "brightRed": "#ff6e6e",
        "brightGreen": "#69ff94",
        "brightYellow": "#ffffa5",
        "brightBlue": "#d6acff",
        "brightMagenta": "#ff92df",
        "brightCyan": "#a4ffff",
        "brightWhite": "#ffffff"
    },
    "hljs": "dracula"
}