{
    "name": "solarized",
    "displayName": "Solarized Dark",
    "description": "Solarized 暗色主题,护眼首选",
    "author": "Ethan Schoonover",
    "version": "1.0.0",
    "terminal": {
        "background": "#002b36",
        "foreground": "#839496",
        "cursor": "#839496",
        "selectionBackground": "#073642",
        "black": "#073642",
        "red": "#dc322f",
        "green": "#859900",
        "yellow": "#b58900",
        "blue": "#268bd2",
        "magenta": "#d33682",
        "cyan": "#2aa198",
        "white": "#eee8d5",
        "brightBlack": "#002b36",
        "brightRed": "#cb4b16",
        "brightGreen": "#586e75",
        "brightYellow": "#657b83",
        "brightBlue": "#839496",
        "brightMagenta": "#6c71c4",
        "brightCyan": "#93a1a1",
        "brightWhite": "#fdf6e3"
    },
    "hljs": "solarized-dark"
}