{
    "name": "monokai",
    "displayName": "Monokai",
    "description": "经典 Monokai 配色,程序员最爱",
    "author": "Wimer Hazenberg",
    "version": "1.0.0",
    "terminal": {
        "background": "#272822",
        "foreground": "#f8f8f2",
        "cursor": "#f8f8f0",
        "selectionBackground": "#49483e",
        "black": "#272822",
        "red": "#f92672",
        "green": "#a6e22e",
        "yellow": "#f4bf75",
        "blue": "#66d9ef",
        "magenta": "#ae81ff",
        "cyan": "#a1efe4",
        "white": "#f8f8f2",
        "brightBlack": "#75715e",
        "brightRed": "#f92672",
        "brightGreen": "#a6e22e",
        "brightYellow": "#e6db74",
        "brightBlue": "#66d9ef",
        "brightMagenta": "#ae81ff",
        "brightCyan": "#a1efe4",
        "brightWhite": "#f9f8f5"
    },
    "hljs": "monokai"
}