{
    "name": "light",
    "displayName": "Light",
    "description": "明亮主题,适合白天使用",
    "author": "AI-TERM Team",
    "version": "1.0.0",
    "terminal": {
        "background": "#ffffff",
        "foreground": "#000000",
        "cursor": "#000000",
        "selectionBackground": "rgba(0, 0, 0, 0.3)",
        "black": "#000000",
        "red": "#cd3131",
        "green": "#00bc00",
        "yellow": "#949800",
        "blue": "#0451a5",
        "magenta": "#bc05bc",
        "cyan": "#0598bc",
        "white": "#555555",
        "brightBlack": "#666666",
        "brightRed": "#cd3131",
        "brightGreen": "#14ce14",
        "brightYellow": "#b5ba00",
        "brightBlue": "#0451a5",
        "brightMagenta": "#bc05bc",
        "brightCyan": "#0598bc",
        "brightWhite": "#a5a5a5"
    },
    "hljs": "github"
}