{
    "name": "vscode",
    "displayName": "VS Code",
    "description": "Visual Studio Code 默认暗色主题",
    "author": "Microsoft",
    "version": "1.0.0",
    "terminal": {
        "background": "#1e1e1e",
        "foreground": "#d4d4d4",
        "cursor": "#ffffff",
        "cursorAccent": "#000000",
        "selectionBackground": "#264f78",
        "black": "#000000",
        "red": "#cd3131",
        "green": "#0dbc79",
        "yellow": "#e5e510",
        "blue": "#2472c8",
        "magenta": "#bc3fbc",
        "cyan": "#11a8cd",
        "white": "#e5e5e5",
        "brightBlack": "#666666",
        "brightRed": "#f14c4c",
        "brightGreen": "#23d18b",
        "brightYellow": "#f5f543",
        "brightBlue": "#3b8eea",
        "brightMagenta": "#d670d6",
        "brightCyan": "#29b8db",
        "brightWhite": "#e5e5e5"
    },
    "hljs": "vs2015"
}